{
  "version": 1,
  "suite": "phase8-forward-tests",
  "description": "Fresh-context style prompts for each registered Product Operating System skill and initial workflow. Prompts intentionally avoid expected fixture paths, rubrics, and answer keys.",
  "cases": [
    {
      "id": "ft-pm-discovery-mixed-feedback",
      "skill_id": "pm-discovery",
      "prompt": "I have interview notes from five admins, three support tickets, and two sales notes about setup confusion. Synthesize the direct customer evidence into themes, confidence levels, opportunities, and the next research step. Keep sales asks separate from customer problems.",
      "fresh_context": true,
      "required_resources": [
        "skills/pm-discovery/procedures/voc-synthesis.md",
        "skills/pm-discovery/procedures/opportunity-framing.md",
        "references/methods/evidence-grading.md",
        "references/checklists/discovery-method-coverage.md"
      ],
      "success_signals": [
        "separates direct evidence from inference",
        "labels confidence by theme",
        "names evidence gaps and next learning step"
      ],
      "prohibited_behaviors": [
        "invented customer evidence",
        "delivery commitment before validation"
      ],
      "capture": {
        "mode": "simulated_fresh_context",
        "status": "pass",
        "observations": [
          "Prompt supplies messy customer evidence sources without linking expected fixtures.",
          "Skill router points to procedures and evidence grading references needed for a useful synthesis."
        ],
        "gaps": [],
        "patched_paths": []
      }
    },
    {
      "id": "ft-pm-strategy-time-critical-prioritization",
      "skill_id": "pm-strategy",
      "prompt": "We have three roadmap options: reduce enterprise churn, unblock a compliance deadline, or improve self-serve activation. Help choose the right prioritization method, score the options with transparent assumptions, and recommend the next decision step. Do not default to RICE if another method fits better.",
      "fresh_context": true,
      "required_resources": [
        "skills/pm-strategy/procedures/prioritization.md",
        "references/frameworks/prioritization-models.md",
        "references/checklists/prioritization-method-coverage.md",
        "templates/prioritization-decision.md"
      ],
      "success_signals": [
        "selects prioritization method based on decision context",
        "shows criteria and assumptions",
        "includes sensitivity or confidence note"
      ],
      "prohibited_behaviors": [
        "automatic RICE scoring",
        "hidden criteria weights"
      ],
      "capture": {
        "mode": "simulated_fresh_context",
        "status": "pass",
        "observations": [
          "Prompt explicitly tests method fit under time pressure and mixed strategic goals.",
          "Existing strategy skill already warns against defaulting to RICE."
        ],
        "gaps": [],
        "patched_paths": []
      }
    },
    {
      "id": "ft-pm-validation-riskiest-assumption",
      "skill_id": "pm-validation",
      "prompt": "We believe managers will invite teammates if the dashboard shows team setup progress, but we have not tested the problem or the solution. Map the riskiest assumptions and design a validation plan with audience, method, success metric, guardrail, and decision rule.",
      "fresh_context": true,
      "required_resources": [
        "skills/pm-validation/procedures/assumption-map.md",
        "skills/pm-validation/procedures/experiment-design.md",
        "references/frameworks/continuous-discovery.md",
        "templates/validation-plan.md"
      ],
      "success_signals": [
        "distinguishes problem validation from solution validation",
        "prioritizes riskiest assumptions",
        "defines metric, guardrail, and decision rule"
      ],
      "prohibited_behaviors": [
        "shipping recommendation without validation",
        "experiment without measurable threshold"
      ],
      "capture": {
        "mode": "simulated_fresh_context",
        "status": "pass",
        "observations": [
          "Prompt forces uncertainty handling rather than a polished recommendation.",
          "Validation skill contains the required quality bar for method, audience, metrics, guardrails, and decision rules."
        ],
        "gaps": [],
        "patched_paths": []
      }
    },
    {
      "id": "ft-pm-design-prototype-brief",
      "skill_id": "pm-design",
      "prompt": "Create a prototype brief for a setup progress dashboard. Include user goal, scenario, screen flow, states, empty/error cases, content needs, usability tasks, and what product decision the prototype should answer.",
      "fresh_context": true,
      "required_resources": [
        "skills/pm-design/procedures/prototype-spec.md",
        "skills/pm-design/procedures/usability-test-plan.md",
        "references/checklists/design-method-coverage.md",
        "templates/usability-test-plan.md"
      ],
      "success_signals": [
        "ties prototype to a product decision",
        "includes states and edge cases",
        "includes usability tasks and success criteria"
      ],
      "prohibited_behaviors": [
        "visual-only design brief",
        "missing empty or error states"
      ],
      "capture": {
        "mode": "simulated_fresh_context",
        "status": "pass",
        "observations": [
          "Prompt tests whether design output remains product-decision oriented.",
          "Design skill has concise output standards and references the method checklist."
        ],
        "gaps": [],
        "patched_paths": []
      }
    },
    {
      "id": "ft-pm-docs-prd-review",
      "skill_id": "pm-docs",
      "prompt": "Review this rough PRD for setup owner assignment. It has a goal, a proposed solution, and a few anecdotes, but weak evidence, unclear non-goals, and no success metrics. Produce a cleaner evidence-backed PRD outline and call out what is still unsupported.",
      "fresh_context": true,
      "required_resources": [
        "skills/pm-docs/procedures/prd.md",
        "skills/pm-docs/procedures/spec-review.md",
        "references/checklists/docs-quality.md",
        "templates/prd.md"
      ],
      "success_signals": [
        "identifies unsupported claims",
        "adds non-goals and measurable success metrics",
        "separates assumptions, risks, and next actions"
      ],
      "prohibited_behaviors": [
        "fake certainty",
        "implementation tasks masquerading as requirements"
      ],
      "capture": {
        "mode": "simulated_fresh_context",
        "status": "pass",
        "observations": [
          "Prompt checks review behavior rather than only clean generation.",
          "Docs skill output standard matches the quality bar and artifact grader expectations."
        ],
        "gaps": [],
        "patched_paths": []
      }
    },
    {
      "id": "ft-pm-delivery-story-split",
      "skill_id": "pm-delivery",
      "prompt": "Break this validated onboarding scope into epics, user stories, acceptance criteria, dependencies, edge cases, failure states, and a sequencing recommendation. Do not create engineering implementation tasks until user value and acceptance criteria are clear.",
      "fresh_context": true,
      "required_resources": [
        "skills/pm-delivery/procedures/epic-breakdown.md",
        "skills/pm-delivery/procedures/story-splitting.md",
        "skills/pm-delivery/procedures/acceptance-criteria.md",
        "references/methods/delivery-methods.md"
      ],
      "success_signals": [
        "keeps stories user-valuable and testable",
        "includes edge cases and failure states",
        "preserves dependencies and sequencing constraints"
      ],
      "prohibited_behaviors": [
        "implementation-only task list",
        "acceptance criteria without observable behavior"
      ],
      "capture": {
        "mode": "simulated_fresh_context",
        "status": "pass",
        "observations": [
          "Prompt exercises delivery decomposition without Linear tooling.",
          "Delivery guardrails cover the main failure mode of premature implementation tasks."
        ],
        "gaps": [],
        "patched_paths": []
      }
    },
    {
      "id": "ft-pm-growth-activation-drop",
      "skill_id": "pm-growth",
      "prompt": "Activation dropped from 48 percent to 34 percent for self-serve teams after invite flow changes. Diagnose the growth loop or funnel bottleneck and propose experiments with target metric, guardrail metric, segment, hypothesis, and decision threshold.",
      "fresh_context": true,
      "required_resources": [
        "skills/pm-growth/procedures/growth-loop-diagnosis.md",
        "skills/pm-growth/procedures/activation-analysis.md",
        "references/frameworks/growth-models.md",
        "templates/experiment-brief.md"
      ],
      "success_signals": [
        "identifies loop or funnel stage",
        "targets the affected segment",
        "defines guardrail and decision threshold"
      ],
      "prohibited_behaviors": [
        "acquisition-only recommendation",
        "experiment without measurable threshold"
      ],
      "capture": {
        "mode": "simulated_fresh_context",
        "status": "pass",
        "observations": [
          "Prompt gives enough metric context to test activation and retention reasoning.",
          "Growth skill output standard directly covers metrics, segment, hypothesis, guardrail, and decision threshold."
        ],
        "gaps": [],
        "patched_paths": []
      }
    },
    {
      "id": "ft-pm-gtm-launch-readiness",
      "skill_id": "pm-gtm",
      "prompt": "We are two weeks from launching teammate setup insights. Create a launch readiness review with audience, positioning, channels, enablement, support plan, rollout risks, success metrics, and post-launch learning loop.",